smartctl 6.4 2015-06-04 r4109 [x86_64-linux-4.1.6-1-ARCH] (local build)
Copyright (C) 2002-15, Bruce Allen, Christian Franke, www.smartmontools.org

=== START OF INFORMATION SECTION ===
Device Model:     SanDisk SD7SN3Q256G1002
Serial Number:    151592400279
LU WWN Device Id: 5 001b44 e57317197
Firmware Version: X2170002
User Capacity:    256,060,514,304 bytes [256 GB]
Sector Size:      512 bytes logical/physical
Rotation Rate:    Solid State Device
Form Factor:      < 1.8 inches
Device is:        Not in smartctl database [for details use: -P showall]
ATA Version is:   ACS-2 T13/2015-D revision 3
SATA Version is:  SATA 3.2, 6.0 Gb/s (current: 6.0 Gb/s)
Local Time is:    Mon Nov 23 09:29:45 2015 MST
SMART support is: Available - device has SMART capability.
SMART support is: Enabled

=== START OF READ SMART DATA SECTION ===
SMART overall-health self-assessment test result: PASSED

General SMART Values:
Offline data collection status:  (0x00)	Offline data collection activity
					was never started.
					Auto Offline Data Collection: Disabled.
Self-test execution status:      ( 666)	Some other result
					This is fake, but it failed :) :) :)
Total time to complete Offline 
data collection: 		(    0) seconds.
Offline data collection
capabilities: 			 (0x11) SMART execute Offline immediate.
					No Auto Offline data collection support.
					Suspend Offline collection upon new
					command.
					No Offline surface scan supported.
					Self-test supported.
					No Conveyance Self-test supported.
					No Selective Self-test supported.
SMART capabilities:            (0x0003)	Saves SMART data before entering
					power-saving mode.
					Supports SMART auto save timer.
Error logging capability:        (0x01)	Error logging supported.
					General Purpose Logging supported.
Short self-test routine 
recommended polling time: 	 (   2) minutes.
Extended self-test routine
recommended polling time: 	 (  10) minutes.

SMART Attributes Data Structure revision number: 4
Vendor Specific SMART Attributes with Thresholds:
ID# ATTRIBUTE_NAME          FLAG     VALUE WORST THRESH TYPE      UPDATED  WHEN_FAILED RAW_VALUE
  5 Reallocated_Sector_Ct   0x0032   100   100   ---    Old_age   Always       -       0
  9 Power_On_Hours          0x0032   253   100   ---    Old_age   Always       -       433
 12 Power_Cycle_Count       0x0032   100   100   ---    Old_age   Always       -       624
166 Unknown_Attribute       0x0032   100   100   ---    Old_age   Always       -       1
167 Unknown_Attribute       0x0032   100   100   ---    Old_age   Always       -       35
168 Unknown_Attribute       0x0032   100   100   ---    Old_age   Always       -       25
169 Unknown_Attribute       0x0032   100   100   ---    Old_age   Always       -       552
171 Unknown_Attribute       0x0032   100   100   ---    Old_age   Always       -       0
172 Unknown_Attribute       0x0032   100   100   ---    Old_age   Always       -       0
173 Unknown_Attribute       0x0032   100   100   ---    Old_age   Always       -       1
174 Unknown_Attribute       0x0032   100   100   ---    Old_age   Always       -       3
184 End-to-End_Error        0x0032   100   100   ---    Old_age   Always       -       0
187 Reported_Uncorrect      0x0032   100   100   ---    Old_age   Always       -       0
188 Command_Timeout         0x0032   100   100   ---    Old_age   Always       -       0
194 Temperature_Celsius     0x0022   061   054   ---    Old_age   Always       -       39 (Min/Max 17/54)
199 UDMA_CRC_Error_Count    0x0032   100   100   ---    Old_age   Always       -       0
212 Unknown_Attribute       0x0032   100   100   ---    Old_age   Always       -       0
230 Unknown_SSD_Attribute   0x0032   100   100   ---    Old_age   Always       -       3
232 Available_Reservd_Space 0x0033   100   100   004    Pre-fail  Always       -       100
233 Media_Wearout_Indicator 0x0032   100   100   ---    Old_age   Always       -       551
241 Total_LBAs_Written      0x0030   253   253   ---    Old_age   Offline      -       304
242 Total_LBAs_Read         0x0030   253   253   ---    Old_age   Offline      -       132
244 Unknown_Attribute       0x0032   000   100   ---    Old_age   Always       -       0

SMART Error Log Version: 1
No Errors Logged

SMART Self-test log structure revision number 1
Num  Test_Description    Status                  Remaining  LifeTime(hours)  LBA_of_first_error
# 1  Extended offline    Completed without error       00%       431         -

Selective Self-tests/Logging not supported



